{"$schema":"https://json-schema.org/draft/2020-12/schema","$id":"evidence-packet.schema.json","title":"REGULUS Evidence Packet","type":"object","additionalProperties":false,"required":["schema_version","packet_id","packet_version","branch_id","hypothesis_id","claim","claim_type","non_claims","evidence_boundary_date","sources","data","design","statistics","rivals","controls","known_disagreements","attachments"],"properties":{"schema_version":{"const":"1.0"},"packet_id":{"type":"string","minLength":1},"packet_version":{"type":"integer","minimum":1},"branch_id":{"type":"string"},"hypothesis_id":{"type":"string"},"claim":{"type":"string"},"claim_type":{"enum":["descriptive","associational","predictive","causal","mechanistic"]},"non_claims":{"type":"array","items":{"type":"string"}},"evidence_boundary_date":{"type":"string"},"sources":{"type":"array","items":{"type":"object","additionalProperties":false,"required":["source_id","type","citation","claim_relevance","limitations"],"properties":{"source_id":{"type":"string","minLength":1},"type":{"enum":["peer_reviewed","preprint","data","code","review","primary_source","secondary_source"]},"citation":{"type":"string"},"claim_relevance":{"type":"string"},"limitations":{"type":"array","items":{"type":"string"}}}}},"data":{"type":"object","additionalProperties":false,"required":["dataset","version","checksum","discovery_status","confirmation_status","prior_exposure","preregistration_timestamp","target_exposure_timestamp"],"properties":{"dataset":{"type":"string","minLength":1},"version":{"type":["string","null"]},"checksum":{"type":["string","null"]},"discovery_status":{"enum":["inspected","uninspected","mixed","unknown"]},"confirmation_status":{"enum":["untouched","previously_inspected","prospective","results_blind","none","unknown"]},"prior_exposure":{"type":"string"},"preregistration_timestamp":{"type":["string","null"]},"target_exposure_timestamp":{"type":["string","null"]}}},"design":{"type":"object"},"statistics":{"type":"object"},"rivals":{"type":"array"},"controls":{"type":"array"},"known_disagreements":{"type":"array"},"attachments":{"type":"array","items":{"type":"object","additionalProperties":false,"required":["path","sha256"],"properties":{"path":{"type":"string"},"sha256":{"type":"string"}}}}}}